<?xml version="1.0" encoding="UTF-8" ?>
<class name="InputHandler" inherits="RefCounted" xmlns:xsi="http://www.w3.org/2001/XMLSchema-instance" xsi:noNamespaceSchemaLocation="../class.xsd">
	<brief_description>
	</brief_description>
	<description>
	</description>
	<tutorials>
	</tutorials>
	<methods>
		<method name="_get_name" qualifiers="virtual const">
			<return type="String" />
			<description>
			</description>
		</method>
		<method name="claim_device">
			<return type="int" />
			<description>
			</description>
		</method>
		<method name="get_name" qualifiers="const">
			<return type="String" />
			<description>
			</description>
		</method>
		<method name="release_device">
			<return type="void" />
			<param index="0" name="device" type="int" />
			<description>
			</description>
		</method>
		<method name="set_device_axis">
			<return type="void" />
			<param index="0" name="device" type="int" />
			<param index="1" name="axis" type="int" enum="JoyAxis" />
			<param index="2" name="value" type="float" />
			<description>
			</description>
		</method>
		<method name="set_device_button">
			<return type="void" />
			<param index="0" name="device" type="int" />
			<param index="1" name="button" type="int" enum="JoyButton" />
			<param index="2" name="pressed" type="bool" />
			<description>
			</description>
		</method>
	</methods>
</class>
